{
  "artifact_ref": {
    "artifact_role": "terrain-height-grid",
    "artifact_status": "REAL_COMPILED",
    "byte_size": 4000375,
    "lineage_hash": "9ab0ea8c7290c8a5ec66d4a7fa89a32425da4e94d44a2835f68b5722a17e7e97",
    "media_type": "application/vnd.nwe.terrain-height-grid",
    "schema": "nwe.artifact-ref/0.1",
    "sha256": "a18805dc506e21810df43a81b802d4d24d44c99fdd3085dddbaa3297d0d2e25a",
    "tile_id": "epsg25832_610000_6677000_1000m",
    "transport": {
      "reference": "cache://compiled/epsg25832_610000_6677000_1000m/terrain-height-grid/a18805dc506e21810df43a81b802d4d24d44c99fdd3085dddbaa3297d0d2e25a.nwehgt"
    }
  },
  "artifact_ref_hash": "767f7f5cdc9e9db62b2759de391ce7f5d426d4dd6aaa602c1df6863ab9043b8d",
  "bundle_schema": "nwe.runtime-verification-bundle/0.1",
  "canonicalization_id": "urn:ietf:rfc:8785",
  "compile_lineage": {
    "artifact_role": "terrain-height-grid",
    "compiler_config_hash": "8024cdee3599a8708c506995211c5544c8f34a8f51f9be6080c737a057d8892b",
    "normalized_snapshot_hashes": [
      "13d93d067cfd9200b6705773e08335c202ad2ad1c74f9571082aa8e50fb3f4ed"
    ],
    "schema": "nwe.compile-lineage/0.1",
    "source_snapshot_hashes": [
      "e047a09b6b63630c24f4ad6dec13dd066996397a3bcb6e51d65a744f5decf980"
    ],
    "tile_id": "epsg25832_610000_6677000_1000m"
  },
  "compiler_config": {
    "compiler_id": "nwe-world-compiler",
    "compiler_version": "0.1.0",
    "quantization": "none",
    "schema": "nwe.compiler-config/0.1",
    "storage": "float32-le-row-major-north-to-south",
    "terrain_format": "nwe-height-grid/0.1",
    "terrain_source_path": "nhm-wcs-direct-grid/0.1"
  },
  "compiler_config_hash": "8024cdee3599a8708c506995211c5544c8f34a8f51f9be6080c737a057d8892b",
  "hash_algorithm": "sha-256",
  "lineage_hash": "9ab0ea8c7290c8a5ec66d4a7fa89a32425da4e94d44a2835f68b5722a17e7e97",
  "normalized_snapshot_hashes": [
    "13d93d067cfd9200b6705773e08335c202ad2ad1c74f9571082aa8e50fb3f4ed"
  ],
  "normalized_snapshots": [
    {
      "byte_size": 4000000,
      "horizontal_crs": "EPSG:25832",
      "media_type": "application/vnd.nwe.normalized-height-grid; profile=nhm-wcs-direct/0.1",
      "sample_count": 1000000,
      "schema": "nwe.normalized-snapshot/0.1",
      "sha256": "0d7c61459ce6f0f90b5958c84263e676e3a4064fb1a2679bd20ee48ab71be7bf",
      "source_snapshot_hash": "e047a09b6b63630c24f4ad6dec13dd066996397a3bcb6e51d65a744f5decf980",
      "transform_contract_hash": "16935dcebc0d1c484f598045b81ab6808d77c9e185a5a6363662e6aa93d7ade4",
      "vertical_datum": "NN2000"
    }
  ],
  "promotion_record": {
    "artifact_ref_hash": "767f7f5cdc9e9db62b2759de391ce7f5d426d4dd6aaa602c1df6863ab9043b8d",
    "from_state": "NORMALIZED",
    "gates": {
      "artifact_bytes_verified": "PASS",
      "compiler_identity_bound": "PASS",
      "determinism_policy_satisfied": "PASS",
      "lineage_reconstructed": "PASS",
      "normalized_bytes_verified": "PASS",
      "source_validated": "PASS",
      "transform_validated": "PASS"
    },
    "lineage_hash": "9ab0ea8c7290c8a5ec66d4a7fa89a32425da4e94d44a2835f68b5722a17e7e97",
    "schema": "nwe.promotion-record/0.1",
    "to_state": "REAL_COMPILED"
  },
  "promotion_record_hash": "a679a1efda2ed59a2baace0601d60ada9b7508a3765e0219027340896bbd2efc",
  "source_snapshot_hashes": [
    "e047a09b6b63630c24f4ad6dec13dd066996397a3bcb6e51d65a744f5decf980"
  ],
  "source_snapshots": [
    {
      "attribution": "\u00a9 Kartverket",
      "license_profile": "CC-BY-4.0",
      "nodata": null,
      "pixel_size": [
        "1",
        "1"
      ],
      "promotion_state": "VALIDATED_SOURCE",
      "raw_byte_size": 4195950,
      "raw_sha256": "195333fa7a25dc0173966e6393e726f2490c0538a1be191b49865c5376202ec2",
      "retrieval_identity": {
        "capabilities_sha256": "30045563eadd52409e50b1f76c3692fe1d99ef43268e10574c5622a0e38ada68",
        "coverage": "nhm_dtm_topo_25832",
        "dataset_id": "8c62e33e-76ba-3c00-9db6-3a10e44135bc",
        "describe_coverage_sha256": "8d320111a5b409d02270027f14e1dedf61338de3422100a553284b8c0569ba86",
        "query_bounds": [
          "610000",
          "6677000",
          "611000",
          "6678000"
        ],
        "request_crs": "EPSG:25832",
        "request_url": "https://wcs.geonorge.no/skwms1/wcs.hoyde-dtm-nhm-25832?SERVICE=WCS&VERSION=1.0.0&REQUEST=GetCoverage&COVERAGE=nhm_dtm_topo_25832&CRS=EPSG%3A25832&RESPONSE_CRS=EPSG%3A25832&BBOX=610000%2C6677000%2C611000%2C6678000&WIDTH=1000&HEIGHT=1000&FORMAT=GeoTIFF",
        "requested_format": "GeoTIFF",
        "requested_height": 1000,
        "requested_width": 1000,
        "response_content_type": "image/tiff",
        "response_crs": "EPSG:25832",
        "service_endpoint": "https://wcs.geonorge.no/skwms1/wcs.hoyde-dtm-nhm-25832",
        "service_metadata_uuid": "05821c51-2f5b-411f-9098-924d13dbea9a",
        "service_protocol": "OGC WCS 1.0.0",
        "tile_id": "epsg25832_610000_6677000_1000m"
      },
      "schema": "nwe.source-snapshot/0.3",
      "source_bounds": [
        "610000",
        "6677000",
        "611000",
        "6678000"
      ],
      "source_crs": "EPSG:25832",
      "source_id": "kartverket:nhm-dtm-25832-wcs",
      "source_vertical_datum": "NN2000",
      "z_semantics": "normal_height_m"
    }
  ],
  "transform_contract_hashes": [
    "16935dcebc0d1c484f598045b81ab6808d77c9e185a5a6363662e6aa93d7ade4"
  ],
  "transform_contracts": [
    {
      "bounds_epsg25832": [
        "610000",
        "6677000",
        "611000",
        "6678000"
      ],
      "height": 1000,
      "horizontal_crs": "EPSG:25832",
      "num_threads": 1,
      "operation": "nhm-wcs-direct-grid-validate-decode-float32-no-resampling",
      "pixel_size_m": "1",
      "resampling": "none",
      "schema": "nwe.transform-contract/0.1",
      "source_crs": "EPSG:25832",
      "source_snapshot_hash": "e047a09b6b63630c24f4ad6dec13dd066996397a3bcb6e51d65a744f5decf980",
      "vertical_datum": "NN2000",
      "vertical_operation": "identity-NN2000",
      "width": 1000
    }
  ]
}
