{
  "artifact_ref": {
    "artifact_role": "terrain-height-grid",
    "artifact_status": "REAL_COMPILED",
    "byte_size": 4000380,
    "lineage_hash": "c81c3cff32f45f85418b539f05cd4778b88f6a03552b5ab6d1f4ae45cade82c5",
    "media_type": "application/vnd.nwe.terrain-height-grid",
    "schema": "nwe.artifact-ref/0.1",
    "sha256": "ad0c3ae7c4f9efba0b1d253a5a235043f4b79f679281aea6949f0f26729647c3",
    "tile_id": "epsg25832_611000_6676000_1000m",
    "transport": {
      "reference": "cache://compiled/epsg25832_611000_6676000_1000m/terrain-height-grid/ad0c3ae7c4f9efba0b1d253a5a235043f4b79f679281aea6949f0f26729647c3.nwehgt"
    }
  },
  "artifact_ref_hash": "444b2d2c3c1499b2bd582ec0c2b2db758426efc1ba4777428a0b8283a9da460e",
  "bundle_schema": "nwe.runtime-verification-bundle/0.1",
  "canonicalization_id": "urn:ietf:rfc:8785",
  "compile_lineage": {
    "artifact_role": "terrain-height-grid",
    "compiler_config_hash": "8024cdee3599a8708c506995211c5544c8f34a8f51f9be6080c737a057d8892b",
    "normalized_snapshot_hashes": [
      "d346c896234e85f471871a4e5d67950e597025a5000339467805129bab47a4d5"
    ],
    "schema": "nwe.compile-lineage/0.1",
    "source_snapshot_hashes": [
      "024cb5b5d231c6edc5fcc6377f51524849beb251f915d0b5b10770443ab4ca97"
    ],
    "tile_id": "epsg25832_611000_6676000_1000m"
  },
  "compiler_config": {
    "compiler_id": "nwe-world-compiler",
    "compiler_version": "0.1.0",
    "quantization": "none",
    "schema": "nwe.compiler-config/0.1",
    "storage": "float32-le-row-major-north-to-south",
    "terrain_format": "nwe-height-grid/0.1",
    "terrain_source_path": "nhm-wcs-direct-grid/0.1"
  },
  "compiler_config_hash": "8024cdee3599a8708c506995211c5544c8f34a8f51f9be6080c737a057d8892b",
  "hash_algorithm": "sha-256",
  "lineage_hash": "c81c3cff32f45f85418b539f05cd4778b88f6a03552b5ab6d1f4ae45cade82c5",
  "normalized_snapshot_hashes": [
    "d346c896234e85f471871a4e5d67950e597025a5000339467805129bab47a4d5"
  ],
  "normalized_snapshots": [
    {
      "byte_size": 4000000,
      "horizontal_crs": "EPSG:25832",
      "media_type": "application/vnd.nwe.normalized-height-grid; profile=nhm-wcs-direct/0.1",
      "sample_count": 1000000,
      "schema": "nwe.normalized-snapshot/0.1",
      "sha256": "2184683669f03d641851700bf79b1109af8fd3f6f3df6ec214e73a6df4840de0",
      "source_snapshot_hash": "024cb5b5d231c6edc5fcc6377f51524849beb251f915d0b5b10770443ab4ca97",
      "transform_contract_hash": "f8df10b3795ff55c533f8e340b41eae907f5d415fe739769fba51c96ad52b7f6",
      "vertical_datum": "NN2000"
    }
  ],
  "promotion_record": {
    "artifact_ref_hash": "444b2d2c3c1499b2bd582ec0c2b2db758426efc1ba4777428a0b8283a9da460e",
    "from_state": "NORMALIZED",
    "gates": {
      "artifact_bytes_verified": "PASS",
      "compiler_identity_bound": "PASS",
      "determinism_policy_satisfied": "PASS",
      "lineage_reconstructed": "PASS",
      "normalized_bytes_verified": "PASS",
      "source_validated": "PASS",
      "transform_validated": "PASS"
    },
    "lineage_hash": "c81c3cff32f45f85418b539f05cd4778b88f6a03552b5ab6d1f4ae45cade82c5",
    "schema": "nwe.promotion-record/0.1",
    "to_state": "REAL_COMPILED"
  },
  "promotion_record_hash": "da0ea3d02df32d226c44e53152787b1471b1a53569e38926dd9efd72b2805fe0",
  "source_snapshot_hashes": [
    "024cb5b5d231c6edc5fcc6377f51524849beb251f915d0b5b10770443ab4ca97"
  ],
  "source_snapshots": [
    {
      "attribution": "\u00a9 Kartverket",
      "license_profile": "CC-BY-4.0",
      "nodata": null,
      "pixel_size": [
        "1",
        "1"
      ],
      "promotion_state": "VALIDATED_SOURCE",
      "raw_byte_size": 4195950,
      "raw_sha256": "f8a8fd5aad4125c1c75b18aa6ec3d8e00bf319cfd76ec8e9e0ad6fadfcb92f48",
      "retrieval_identity": {
        "capabilities_sha256": "30045563eadd52409e50b1f76c3692fe1d99ef43268e10574c5622a0e38ada68",
        "coverage": "nhm_dtm_topo_25832",
        "dataset_id": "8c62e33e-76ba-3c00-9db6-3a10e44135bc",
        "describe_coverage_sha256": "8d320111a5b409d02270027f14e1dedf61338de3422100a553284b8c0569ba86",
        "query_bounds": [
          "611000",
          "6676000",
          "612000",
          "6677000"
        ],
        "request_crs": "EPSG:25832",
        "request_url": "https://wcs.geonorge.no/skwms1/wcs.hoyde-dtm-nhm-25832?SERVICE=WCS&VERSION=1.0.0&REQUEST=GetCoverage&COVERAGE=nhm_dtm_topo_25832&CRS=EPSG%3A25832&RESPONSE_CRS=EPSG%3A25832&BBOX=611000%2C6676000%2C612000%2C6677000&WIDTH=1000&HEIGHT=1000&FORMAT=GeoTIFF",
        "requested_format": "GeoTIFF",
        "requested_height": 1000,
        "requested_width": 1000,
        "response_content_type": "image/tiff",
        "response_crs": "EPSG:25832",
        "service_endpoint": "https://wcs.geonorge.no/skwms1/wcs.hoyde-dtm-nhm-25832",
        "service_metadata_uuid": "05821c51-2f5b-411f-9098-924d13dbea9a",
        "service_protocol": "OGC WCS 1.0.0",
        "tile_id": "epsg25832_611000_6676000_1000m"
      },
      "schema": "nwe.source-snapshot/0.3",
      "source_bounds": [
        "611000",
        "6676000",
        "612000",
        "6677000"
      ],
      "source_crs": "EPSG:25832",
      "source_id": "kartverket:nhm-dtm-25832-wcs",
      "source_vertical_datum": "NN2000",
      "z_semantics": "normal_height_m"
    }
  ],
  "transform_contract_hashes": [
    "f8df10b3795ff55c533f8e340b41eae907f5d415fe739769fba51c96ad52b7f6"
  ],
  "transform_contracts": [
    {
      "bounds_epsg25832": [
        "611000",
        "6676000",
        "612000",
        "6677000"
      ],
      "height": 1000,
      "horizontal_crs": "EPSG:25832",
      "num_threads": 1,
      "operation": "nhm-wcs-direct-grid-validate-decode-float32-no-resampling",
      "pixel_size_m": "1",
      "resampling": "none",
      "schema": "nwe.transform-contract/0.1",
      "source_crs": "EPSG:25832",
      "source_snapshot_hash": "024cb5b5d231c6edc5fcc6377f51524849beb251f915d0b5b10770443ab4ca97",
      "vertical_datum": "NN2000",
      "vertical_operation": "identity-NN2000",
      "width": 1000
    }
  ]
}
