{
  "artifact_ref": {
    "artifact_role": "terrain-height-grid",
    "artifact_status": "REAL_COMPILED",
    "byte_size": 4000380,
    "lineage_hash": "a7350ca8e157c0938b654aae90c6d0049f8dd4aa2ab7ed7e61503c9a38d04e87",
    "media_type": "application/vnd.nwe.terrain-height-grid",
    "schema": "nwe.artifact-ref/0.1",
    "sha256": "5d6fb6389bee43688fb232af939c0c5e813d09f29daca897364257f5b9da5ddc",
    "tile_id": "epsg25832_611000_6678000_1000m",
    "transport": {
      "reference": "cache://compiled/epsg25832_611000_6678000_1000m/terrain-height-grid/5d6fb6389bee43688fb232af939c0c5e813d09f29daca897364257f5b9da5ddc.nwehgt"
    }
  },
  "artifact_ref_hash": "10e254f09dc3c6929048072ef52a9ba72657fe738ac794add2c19c14eb081caa",
  "bundle_schema": "nwe.runtime-verification-bundle/0.1",
  "canonicalization_id": "urn:ietf:rfc:8785",
  "compile_lineage": {
    "artifact_role": "terrain-height-grid",
    "compiler_config_hash": "8024cdee3599a8708c506995211c5544c8f34a8f51f9be6080c737a057d8892b",
    "normalized_snapshot_hashes": [
      "b84055decf066b2446406ec79ccdc2bec0e4a407de448d64afeae38927a72081"
    ],
    "schema": "nwe.compile-lineage/0.1",
    "source_snapshot_hashes": [
      "842b37043d62eb061973777fe7ed47683b49364a84f3c1c1e69131671a6acfde"
    ],
    "tile_id": "epsg25832_611000_6678000_1000m"
  },
  "compiler_config": {
    "compiler_id": "nwe-world-compiler",
    "compiler_version": "0.1.0",
    "quantization": "none",
    "schema": "nwe.compiler-config/0.1",
    "storage": "float32-le-row-major-north-to-south",
    "terrain_format": "nwe-height-grid/0.1",
    "terrain_source_path": "nhm-wcs-direct-grid/0.1"
  },
  "compiler_config_hash": "8024cdee3599a8708c506995211c5544c8f34a8f51f9be6080c737a057d8892b",
  "hash_algorithm": "sha-256",
  "lineage_hash": "a7350ca8e157c0938b654aae90c6d0049f8dd4aa2ab7ed7e61503c9a38d04e87",
  "normalized_snapshot_hashes": [
    "b84055decf066b2446406ec79ccdc2bec0e4a407de448d64afeae38927a72081"
  ],
  "normalized_snapshots": [
    {
      "byte_size": 4000000,
      "horizontal_crs": "EPSG:25832",
      "media_type": "application/vnd.nwe.normalized-height-grid; profile=nhm-wcs-direct/0.1",
      "sample_count": 1000000,
      "schema": "nwe.normalized-snapshot/0.1",
      "sha256": "10d76d518b8a490aef731be72c158f640dc36f0eab976ea2c84d56e1e4d70f2b",
      "source_snapshot_hash": "842b37043d62eb061973777fe7ed47683b49364a84f3c1c1e69131671a6acfde",
      "transform_contract_hash": "55f3c216bd11ec2041542c23720487e8ee66cddca39893e514802fb88f5c9a6d",
      "vertical_datum": "NN2000"
    }
  ],
  "promotion_record": {
    "artifact_ref_hash": "10e254f09dc3c6929048072ef52a9ba72657fe738ac794add2c19c14eb081caa",
    "from_state": "NORMALIZED",
    "gates": {
      "artifact_bytes_verified": "PASS",
      "compiler_identity_bound": "PASS",
      "determinism_policy_satisfied": "PASS",
      "lineage_reconstructed": "PASS",
      "normalized_bytes_verified": "PASS",
      "source_validated": "PASS",
      "transform_validated": "PASS"
    },
    "lineage_hash": "a7350ca8e157c0938b654aae90c6d0049f8dd4aa2ab7ed7e61503c9a38d04e87",
    "schema": "nwe.promotion-record/0.1",
    "to_state": "REAL_COMPILED"
  },
  "promotion_record_hash": "fca0cd65000d2812c4c122c40e8b11ce56da0e80d339050774123f75032b48e3",
  "source_snapshot_hashes": [
    "842b37043d62eb061973777fe7ed47683b49364a84f3c1c1e69131671a6acfde"
  ],
  "source_snapshots": [
    {
      "attribution": "\u00a9 Kartverket",
      "license_profile": "CC-BY-4.0",
      "nodata": null,
      "pixel_size": [
        "1",
        "1"
      ],
      "promotion_state": "VALIDATED_SOURCE",
      "raw_byte_size": 4195950,
      "raw_sha256": "05dd395af618d3c9ff804c0eea3911fd91b75f074aeeb84c6342ddb75f480cf0",
      "retrieval_identity": {
        "capabilities_sha256": "30045563eadd52409e50b1f76c3692fe1d99ef43268e10574c5622a0e38ada68",
        "coverage": "nhm_dtm_topo_25832",
        "dataset_id": "8c62e33e-76ba-3c00-9db6-3a10e44135bc",
        "describe_coverage_sha256": "8d320111a5b409d02270027f14e1dedf61338de3422100a553284b8c0569ba86",
        "query_bounds": [
          "611000",
          "6678000",
          "612000",
          "6679000"
        ],
        "request_crs": "EPSG:25832",
        "request_url": "https://wcs.geonorge.no/skwms1/wcs.hoyde-dtm-nhm-25832?SERVICE=WCS&VERSION=1.0.0&REQUEST=GetCoverage&COVERAGE=nhm_dtm_topo_25832&CRS=EPSG%3A25832&RESPONSE_CRS=EPSG%3A25832&BBOX=611000%2C6678000%2C612000%2C6679000&WIDTH=1000&HEIGHT=1000&FORMAT=GeoTIFF",
        "requested_format": "GeoTIFF",
        "requested_height": 1000,
        "requested_width": 1000,
        "response_content_type": "image/tiff",
        "response_crs": "EPSG:25832",
        "service_endpoint": "https://wcs.geonorge.no/skwms1/wcs.hoyde-dtm-nhm-25832",
        "service_metadata_uuid": "05821c51-2f5b-411f-9098-924d13dbea9a",
        "service_protocol": "OGC WCS 1.0.0",
        "tile_id": "epsg25832_611000_6678000_1000m"
      },
      "schema": "nwe.source-snapshot/0.3",
      "source_bounds": [
        "611000",
        "6678000",
        "612000",
        "6679000"
      ],
      "source_crs": "EPSG:25832",
      "source_id": "kartverket:nhm-dtm-25832-wcs",
      "source_vertical_datum": "NN2000",
      "z_semantics": "normal_height_m"
    }
  ],
  "transform_contract_hashes": [
    "55f3c216bd11ec2041542c23720487e8ee66cddca39893e514802fb88f5c9a6d"
  ],
  "transform_contracts": [
    {
      "bounds_epsg25832": [
        "611000",
        "6678000",
        "612000",
        "6679000"
      ],
      "height": 1000,
      "horizontal_crs": "EPSG:25832",
      "num_threads": 1,
      "operation": "nhm-wcs-direct-grid-validate-decode-float32-no-resampling",
      "pixel_size_m": "1",
      "resampling": "none",
      "schema": "nwe.transform-contract/0.1",
      "source_crs": "EPSG:25832",
      "source_snapshot_hash": "842b37043d62eb061973777fe7ed47683b49364a84f3c1c1e69131671a6acfde",
      "vertical_datum": "NN2000",
      "vertical_operation": "identity-NN2000",
      "width": 1000
    }
  ]
}
