{
  "artifact_ref": {
    "artifact_role": "terrain-height-grid",
    "artifact_status": "REAL_COMPILED",
    "byte_size": 4000379,
    "lineage_hash": "5a59f803a383322a21e492b85e6985fe72b905f803fee1912f789480cf9c21a1",
    "media_type": "application/vnd.nwe.terrain-height-grid",
    "schema": "nwe.artifact-ref/0.1",
    "sha256": "0ca537b0e58dd40edaecde2b9f4b627ce837328d03d0db6c56f655520096e18b",
    "tile_id": "epsg25832_612000_6676000_1000m",
    "transport": {
      "reference": "cache://compiled/epsg25832_612000_6676000_1000m/terrain-height-grid/0ca537b0e58dd40edaecde2b9f4b627ce837328d03d0db6c56f655520096e18b.nwehgt"
    }
  },
  "artifact_ref_hash": "3d9bf33c701bcebafb895fd0d5d74269acb08577967aa5be33bd9bb162b6ecae",
  "bundle_schema": "nwe.runtime-verification-bundle/0.1",
  "canonicalization_id": "urn:ietf:rfc:8785",
  "compile_lineage": {
    "artifact_role": "terrain-height-grid",
    "compiler_config_hash": "8024cdee3599a8708c506995211c5544c8f34a8f51f9be6080c737a057d8892b",
    "normalized_snapshot_hashes": [
      "2e0daf27cdaf3d93b6d55ef02e8e7f34e528934f8729c27262689fd8ccd0b98d"
    ],
    "schema": "nwe.compile-lineage/0.1",
    "source_snapshot_hashes": [
      "f32d78600f459a8ca3208f6a12683f5e9c691f85d750e4af3a1a3f02f4c2225f"
    ],
    "tile_id": "epsg25832_612000_6676000_1000m"
  },
  "compiler_config": {
    "compiler_id": "nwe-world-compiler",
    "compiler_version": "0.1.0",
    "quantization": "none",
    "schema": "nwe.compiler-config/0.1",
    "storage": "float32-le-row-major-north-to-south",
    "terrain_format": "nwe-height-grid/0.1",
    "terrain_source_path": "nhm-wcs-direct-grid/0.1"
  },
  "compiler_config_hash": "8024cdee3599a8708c506995211c5544c8f34a8f51f9be6080c737a057d8892b",
  "hash_algorithm": "sha-256",
  "lineage_hash": "5a59f803a383322a21e492b85e6985fe72b905f803fee1912f789480cf9c21a1",
  "normalized_snapshot_hashes": [
    "2e0daf27cdaf3d93b6d55ef02e8e7f34e528934f8729c27262689fd8ccd0b98d"
  ],
  "normalized_snapshots": [
    {
      "byte_size": 4000000,
      "horizontal_crs": "EPSG:25832",
      "media_type": "application/vnd.nwe.normalized-height-grid; profile=nhm-wcs-direct/0.1",
      "sample_count": 1000000,
      "schema": "nwe.normalized-snapshot/0.1",
      "sha256": "53a0669c9b023b5db921448b5fd29d53cc9ef46a89cfa9dc8c280d1ad6107334",
      "source_snapshot_hash": "f32d78600f459a8ca3208f6a12683f5e9c691f85d750e4af3a1a3f02f4c2225f",
      "transform_contract_hash": "9824fe81f822bda80c71ee1629754539e019cb77348c96c48a36bec71158afc4",
      "vertical_datum": "NN2000"
    }
  ],
  "promotion_record": {
    "artifact_ref_hash": "3d9bf33c701bcebafb895fd0d5d74269acb08577967aa5be33bd9bb162b6ecae",
    "from_state": "NORMALIZED",
    "gates": {
      "artifact_bytes_verified": "PASS",
      "compiler_identity_bound": "PASS",
      "determinism_policy_satisfied": "PASS",
      "lineage_reconstructed": "PASS",
      "normalized_bytes_verified": "PASS",
      "source_validated": "PASS",
      "transform_validated": "PASS"
    },
    "lineage_hash": "5a59f803a383322a21e492b85e6985fe72b905f803fee1912f789480cf9c21a1",
    "schema": "nwe.promotion-record/0.1",
    "to_state": "REAL_COMPILED"
  },
  "promotion_record_hash": "02e77920629604a514d1714b92be098dcd9177f97b67977ceb1955b9d8e3338d",
  "source_snapshot_hashes": [
    "f32d78600f459a8ca3208f6a12683f5e9c691f85d750e4af3a1a3f02f4c2225f"
  ],
  "source_snapshots": [
    {
      "attribution": "\u00a9 Kartverket",
      "license_profile": "CC-BY-4.0",
      "nodata": null,
      "pixel_size": [
        "1",
        "1"
      ],
      "promotion_state": "VALIDATED_SOURCE",
      "raw_byte_size": 4195950,
      "raw_sha256": "bcf949644df589960e34b9847c930e6147b569f9dddaf5fdf930990131836427",
      "retrieval_identity": {
        "capabilities_sha256": "30045563eadd52409e50b1f76c3692fe1d99ef43268e10574c5622a0e38ada68",
        "coverage": "nhm_dtm_topo_25832",
        "dataset_id": "8c62e33e-76ba-3c00-9db6-3a10e44135bc",
        "describe_coverage_sha256": "8d320111a5b409d02270027f14e1dedf61338de3422100a553284b8c0569ba86",
        "query_bounds": [
          "612000",
          "6676000",
          "613000",
          "6677000"
        ],
        "request_crs": "EPSG:25832",
        "request_url": "https://wcs.geonorge.no/skwms1/wcs.hoyde-dtm-nhm-25832?SERVICE=WCS&VERSION=1.0.0&REQUEST=GetCoverage&COVERAGE=nhm_dtm_topo_25832&CRS=EPSG%3A25832&RESPONSE_CRS=EPSG%3A25832&BBOX=612000%2C6676000%2C613000%2C6677000&WIDTH=1000&HEIGHT=1000&FORMAT=GeoTIFF",
        "requested_format": "GeoTIFF",
        "requested_height": 1000,
        "requested_width": 1000,
        "response_content_type": "image/tiff",
        "response_crs": "EPSG:25832",
        "service_endpoint": "https://wcs.geonorge.no/skwms1/wcs.hoyde-dtm-nhm-25832",
        "service_metadata_uuid": "05821c51-2f5b-411f-9098-924d13dbea9a",
        "service_protocol": "OGC WCS 1.0.0",
        "tile_id": "epsg25832_612000_6676000_1000m"
      },
      "schema": "nwe.source-snapshot/0.3",
      "source_bounds": [
        "612000",
        "6676000",
        "613000",
        "6677000"
      ],
      "source_crs": "EPSG:25832",
      "source_id": "kartverket:nhm-dtm-25832-wcs",
      "source_vertical_datum": "NN2000",
      "z_semantics": "normal_height_m"
    }
  ],
  "transform_contract_hashes": [
    "9824fe81f822bda80c71ee1629754539e019cb77348c96c48a36bec71158afc4"
  ],
  "transform_contracts": [
    {
      "bounds_epsg25832": [
        "612000",
        "6676000",
        "613000",
        "6677000"
      ],
      "height": 1000,
      "horizontal_crs": "EPSG:25832",
      "num_threads": 1,
      "operation": "nhm-wcs-direct-grid-validate-decode-float32-no-resampling",
      "pixel_size_m": "1",
      "resampling": "none",
      "schema": "nwe.transform-contract/0.1",
      "source_crs": "EPSG:25832",
      "source_snapshot_hash": "f32d78600f459a8ca3208f6a12683f5e9c691f85d750e4af3a1a3f02f4c2225f",
      "vertical_datum": "NN2000",
      "vertical_operation": "identity-NN2000",
      "width": 1000
    }
  ]
}
