{
  "artifact_ref": {
    "artifact_role": "terrain-height-grid",
    "artifact_status": "REAL_COMPILED",
    "byte_size": 4000381,
    "lineage_hash": "ca0cb841a9a68e12648cb2736025d10b2d28f246aebb4043f7b940d784aade69",
    "media_type": "application/vnd.nwe.terrain-height-grid",
    "schema": "nwe.artifact-ref/0.1",
    "sha256": "a0f6107ce9497a9e7221aa06a7b590cb9b8b2958ac316c32ef79059e604b052e",
    "tile_id": "epsg25832_611000_6677000_1000m",
    "transport": {
      "reference": "cache://compiled/epsg25832_611000_6677000_1000m/terrain-height-grid/a0f6107ce9497a9e7221aa06a7b590cb9b8b2958ac316c32ef79059e604b052e.nwehgt"
    }
  },
  "artifact_ref_hash": "a7f961b2f9ccfe1aac49e2a6f9222c01eabca29c7352222606e33e69028e6f2a",
  "bundle_schema": "nwe.runtime-verification-bundle/0.1",
  "canonicalization_id": "urn:ietf:rfc:8785",
  "compile_lineage": {
    "artifact_role": "terrain-height-grid",
    "compiler_config_hash": "8024cdee3599a8708c506995211c5544c8f34a8f51f9be6080c737a057d8892b",
    "normalized_snapshot_hashes": [
      "e4767396c9cfdb3747984442d73421772b5f3dec77effc471b02090fde49378b"
    ],
    "schema": "nwe.compile-lineage/0.1",
    "source_snapshot_hashes": [
      "40a77348314bc1587356ec1d0dee873c13e11b15a50087643969b637bc85c9a1"
    ],
    "tile_id": "epsg25832_611000_6677000_1000m"
  },
  "compiler_config": {
    "compiler_id": "nwe-world-compiler",
    "compiler_version": "0.1.0",
    "quantization": "none",
    "schema": "nwe.compiler-config/0.1",
    "storage": "float32-le-row-major-north-to-south",
    "terrain_format": "nwe-height-grid/0.1",
    "terrain_source_path": "nhm-wcs-direct-grid/0.1"
  },
  "compiler_config_hash": "8024cdee3599a8708c506995211c5544c8f34a8f51f9be6080c737a057d8892b",
  "hash_algorithm": "sha-256",
  "lineage_hash": "ca0cb841a9a68e12648cb2736025d10b2d28f246aebb4043f7b940d784aade69",
  "normalized_snapshot_hashes": [
    "e4767396c9cfdb3747984442d73421772b5f3dec77effc471b02090fde49378b"
  ],
  "normalized_snapshots": [
    {
      "byte_size": 4000000,
      "horizontal_crs": "EPSG:25832",
      "media_type": "application/vnd.nwe.normalized-height-grid; profile=nhm-wcs-direct/0.1",
      "sample_count": 1000000,
      "schema": "nwe.normalized-snapshot/0.1",
      "sha256": "2768a7134f70080ed3cfc976df79cca91598ee5a562b452adc4f95c372c7c1eb",
      "source_snapshot_hash": "40a77348314bc1587356ec1d0dee873c13e11b15a50087643969b637bc85c9a1",
      "transform_contract_hash": "629495fb9c7db20d85d8ad33e5e34dd70364279e40f89322f0bb786d134c5625",
      "vertical_datum": "NN2000"
    }
  ],
  "promotion_record": {
    "artifact_ref_hash": "a7f961b2f9ccfe1aac49e2a6f9222c01eabca29c7352222606e33e69028e6f2a",
    "from_state": "NORMALIZED",
    "gates": {
      "artifact_bytes_verified": "PASS",
      "compiler_identity_bound": "PASS",
      "determinism_policy_satisfied": "PASS",
      "lineage_reconstructed": "PASS",
      "normalized_bytes_verified": "PASS",
      "source_validated": "PASS",
      "transform_validated": "PASS"
    },
    "lineage_hash": "ca0cb841a9a68e12648cb2736025d10b2d28f246aebb4043f7b940d784aade69",
    "schema": "nwe.promotion-record/0.1",
    "to_state": "REAL_COMPILED"
  },
  "promotion_record_hash": "eaec88aa7710d14e4bc51059d472d114c5dc7071ab26b075872ed215bebeac8b",
  "source_snapshot_hashes": [
    "40a77348314bc1587356ec1d0dee873c13e11b15a50087643969b637bc85c9a1"
  ],
  "source_snapshots": [
    {
      "attribution": "\u00a9 Kartverket",
      "license_profile": "CC-BY-4.0",
      "nodata": null,
      "pixel_size": [
        "1",
        "1"
      ],
      "promotion_state": "VALIDATED_SOURCE",
      "raw_byte_size": 4195950,
      "raw_sha256": "6f7f5e3abcdcb727b69470639733179916ad57128de41ca8691216798300a8a8",
      "retrieval_identity": {
        "capabilities_sha256": "30045563eadd52409e50b1f76c3692fe1d99ef43268e10574c5622a0e38ada68",
        "coverage": "nhm_dtm_topo_25832",
        "dataset_id": "8c62e33e-76ba-3c00-9db6-3a10e44135bc",
        "describe_coverage_sha256": "8d320111a5b409d02270027f14e1dedf61338de3422100a553284b8c0569ba86",
        "query_bounds": [
          "611000",
          "6677000",
          "612000",
          "6678000"
        ],
        "request_crs": "EPSG:25832",
        "request_url": "https://wcs.geonorge.no/skwms1/wcs.hoyde-dtm-nhm-25832?SERVICE=WCS&VERSION=1.0.0&REQUEST=GetCoverage&COVERAGE=nhm_dtm_topo_25832&CRS=EPSG%3A25832&RESPONSE_CRS=EPSG%3A25832&BBOX=611000%2C6677000%2C612000%2C6678000&WIDTH=1000&HEIGHT=1000&FORMAT=GeoTIFF",
        "requested_format": "GeoTIFF",
        "requested_height": 1000,
        "requested_width": 1000,
        "response_content_type": "image/tiff",
        "response_crs": "EPSG:25832",
        "service_endpoint": "https://wcs.geonorge.no/skwms1/wcs.hoyde-dtm-nhm-25832",
        "service_metadata_uuid": "05821c51-2f5b-411f-9098-924d13dbea9a",
        "service_protocol": "OGC WCS 1.0.0",
        "tile_id": "epsg25832_611000_6677000_1000m"
      },
      "schema": "nwe.source-snapshot/0.3",
      "source_bounds": [
        "611000",
        "6677000",
        "612000",
        "6678000"
      ],
      "source_crs": "EPSG:25832",
      "source_id": "kartverket:nhm-dtm-25832-wcs",
      "source_vertical_datum": "NN2000",
      "z_semantics": "normal_height_m"
    }
  ],
  "transform_contract_hashes": [
    "629495fb9c7db20d85d8ad33e5e34dd70364279e40f89322f0bb786d134c5625"
  ],
  "transform_contracts": [
    {
      "bounds_epsg25832": [
        "611000",
        "6677000",
        "612000",
        "6678000"
      ],
      "height": 1000,
      "horizontal_crs": "EPSG:25832",
      "num_threads": 1,
      "operation": "nhm-wcs-direct-grid-validate-decode-float32-no-resampling",
      "pixel_size_m": "1",
      "resampling": "none",
      "schema": "nwe.transform-contract/0.1",
      "source_crs": "EPSG:25832",
      "source_snapshot_hash": "40a77348314bc1587356ec1d0dee873c13e11b15a50087643969b637bc85c9a1",
      "vertical_datum": "NN2000",
      "vertical_operation": "identity-NN2000",
      "width": 1000
    }
  ]
}
