{"artifact_ref":{"artifact_role":"building-footprints","artifact_status":"REAL_COMPILED","byte_size":80846,"lineage_hash":"ea21d92d0dd98d16d7dc61a27a2b29458630aa6202b59059e93d87d42b40f15c","media_type":"application/json; profile=nwe.building-footprint-artifact/0.1","schema":"nwe.artifact-ref/0.1","sha256":"678c59603fba2b66d93e7a2252a3c3260a3d80d6a1da0db2c235b9c71423f7cd","tile_id":"epsg25832_611000_6677000_1000m","transport":{"reference":"cache://compiled/epsg25832_611000_6677000_1000m/building-footprints/678c59603fba2b66d93e7a2252a3c3260a3d80d6a1da0db2c235b9c71423f7cd.json"}},"artifact_ref_hash":"bdf3ae9dc49d8c48a487ef97572180873f68399b0ac27fc855ad785ecda14a8c","bundle_schema":"nwe.runtime-verification-bundle/0.1","canonicalization_id":"urn:ietf:rfc:8785","compile_lineage":{"artifact_role":"building-footprints","compiler_config_hash":"ce97063d187327e1065ed9ef742766398441267fe0acde4afce93625cb1f2fc6","normalized_snapshot_hashes":["8b2560fca97418322d5d3fee6d4980170f0444f8068b938594b4c9815c4905a3"],"schema":"nwe.compile-lineage/0.1","source_snapshot_hashes":["6680106bf1c519c2e315d77970adc39d5778ce3debaf91b0d99a127d074426ff"],"tile_id":"epsg25832_611000_6677000_1000m"},"compiler_config":{"building_geometry_policy":"valid-polygon-clip-v0.1","building_height_policy":"explicit-height-or-levels-provenance-no-fallback","building_surface_semantics_policy":"selected-osm-roof-and-material-tags-pass-through-v0.1","compiler_id":"nwe-world-compiler","compiler_version":"0.1.0","schema":"nwe.compiler-config/0.1"},"compiler_config_hash":"ce97063d187327e1065ed9ef742766398441267fe0acde4afce93625cb1f2fc6","hash_algorithm":"sha-256","lineage_hash":"ea21d92d0dd98d16d7dc61a27a2b29458630aa6202b59059e93d87d42b40f15c","normalized_snapshot_hashes":["8b2560fca97418322d5d3fee6d4980170f0444f8068b938594b4c9815c4905a3"],"normalized_snapshots":[{"byte_size":87007,"feature_count":135,"media_type":"application/json; profile=nwe.normalized-building-footprints/0.1","schema":"nwe.normalized-snapshot/0.1","sha256":"148cb6775c19dc4e70ef44ed27df7740ab3afbb0c16e798af29ba384f24c68bf","source_snapshot_hash":"6680106bf1c519c2e315d77970adc39d5778ce3debaf91b0d99a127d074426ff","transform_contract_hash":"87c3b43c93f6636c3da68be5dbf575a3fe693b17b1bd9c3ccd6dc0c8669a8511"}],"promotion_record":{"artifact_ref_hash":"bdf3ae9dc49d8c48a487ef97572180873f68399b0ac27fc855ad785ecda14a8c","from_state":"NORMALIZED","gates":{"artifact_bytes_verified":"PASS","compiler_identity_bound":"PASS","determinism_policy_satisfied":"PASS","lineage_reconstructed":"PASS","normalized_bytes_verified":"PASS","source_validated":"PASS","transform_validated":"PASS"},"lineage_hash":"ea21d92d0dd98d16d7dc61a27a2b29458630aa6202b59059e93d87d42b40f15c","schema":"nwe.promotion-record/0.1","to_state":"REAL_COMPILED"},"promotion_record_hash":"01badb2dc24596765afb867436da02f9330b36766c3c0ab82292228d5d169c33","source_snapshot_hashes":["6680106bf1c519c2e315d77970adc39d5778ce3debaf91b0d99a127d074426ff"],"source_snapshots":[{"attribution":"© OpenStreetMap contributors","license_profile":"ODbL-1.0","promotion_state":"VALIDATED_SOURCE","raw_byte_size":1052621,"raw_sha256":"b96a4e007a20210e2f304d772cfa1eb1efdc789609dfee3bb5b0b33164dde817","retrieval_identity":{"query_bounds":["11.00323908421006","60.214367176568494","11.021825770804512","60.223614277941905"],"request_url":"https://api.openstreetmap.org/api/0.6/map.json?bbox=11.00323908421006,60.214367176568494,11.021825770804512,60.223614277941905","tile_id":"epsg25832_611000_6677000_1000m"},"schema":"nwe.source-snapshot/0.3","source_crs":"EPSG:4326","source_id":"openstreetmap:api-0.6:map","source_vertical_datum":null,"z_semantics":"none"}],"transform_contract_hashes":["87c3b43c93f6636c3da68be5dbf575a3fe693b17b1bd9c3ccd6dc0c8669a8511"],"transform_contracts":[{"bounds_epsg25832":["611000","6677000","612000","6678000"],"horizontal_crs":"EPSG:25832","operation":"osm-api06-wgs84-reproject-validate-clip-epsg25832","schema":"nwe.transform-contract/0.1","source_crs":"EPSG:4326","source_snapshot_hash":"6680106bf1c519c2e315d77970adc39d5778ce3debaf91b0d99a127d074426ff","vertical_datum":null}]}