{"artifact_ref":{"artifact_role":"building-footprints","artifact_status":"REAL_COMPILED","byte_size":80846,"lineage_hash":"5dddf2b152736fb23d61c910e6fc8408e5429c2279cc6679e125f4871a1a9958","media_type":"application/json; profile=nwe.building-footprint-artifact/0.1","schema":"nwe.artifact-ref/0.1","sha256":"678c59603fba2b66d93e7a2252a3c3260a3d80d6a1da0db2c235b9c71423f7cd","tile_id":"epsg25832_611000_6677000_1000m","transport":{"reference":"cache://compiled/epsg25832_611000_6677000_1000m/building-footprints/678c59603fba2b66d93e7a2252a3c3260a3d80d6a1da0db2c235b9c71423f7cd.json"}},"artifact_ref_hash":"669c3a876a22ba018cb5d4874b98c5d425e410e8beb40c48d5c76efab18d9980","bundle_schema":"nwe.runtime-verification-bundle/0.1","canonicalization_id":"urn:ietf:rfc:8785","compile_lineage":{"artifact_role":"building-footprints","compiler_config_hash":"209f6a6552f91a79821981a5b1b1d86dd35cc1620d7502359452155bacc2e83f","normalized_snapshot_hashes":["9dde2204880ea2dec88573d16822ea4f01b1fd854c2cb9988c850535119a0906"],"schema":"nwe.compile-lineage/0.1","source_snapshot_hashes":["6d1b5611c7f7fe97ca1dcf8354ba36cf326cc2f4cfea8a8bf15836dd617e0378"],"tile_id":"epsg25832_611000_6677000_1000m"},"compiler_config":{"building_geometry_policy":"valid-polygon-clip-v0.1","building_height_policy":"explicit-height-or-levels-provenance-no-fallback","compiler_id":"nwe-world-compiler","compiler_version":"0.1.0","schema":"nwe.compiler-config/0.1"},"compiler_config_hash":"209f6a6552f91a79821981a5b1b1d86dd35cc1620d7502359452155bacc2e83f","hash_algorithm":"sha-256","lineage_hash":"5dddf2b152736fb23d61c910e6fc8408e5429c2279cc6679e125f4871a1a9958","normalized_snapshot_hashes":["9dde2204880ea2dec88573d16822ea4f01b1fd854c2cb9988c850535119a0906"],"normalized_snapshots":[{"byte_size":87007,"feature_count":135,"media_type":"application/json; profile=nwe.normalized-building-footprints/0.1","schema":"nwe.normalized-snapshot/0.1","sha256":"148cb6775c19dc4e70ef44ed27df7740ab3afbb0c16e798af29ba384f24c68bf","source_snapshot_hash":"6d1b5611c7f7fe97ca1dcf8354ba36cf326cc2f4cfea8a8bf15836dd617e0378","transform_contract_hash":"16b119b02728dace37371c16c9123123b0fcb9080501e30af31ee45ccbba940c"}],"promotion_record":{"artifact_ref_hash":"669c3a876a22ba018cb5d4874b98c5d425e410e8beb40c48d5c76efab18d9980","from_state":"NORMALIZED","gates":{"artifact_bytes_verified":"PASS","compiler_identity_bound":"PASS","determinism_policy_satisfied":"PASS","lineage_reconstructed":"PASS","normalized_bytes_verified":"PASS","source_validated":"PASS","transform_validated":"PASS"},"lineage_hash":"5dddf2b152736fb23d61c910e6fc8408e5429c2279cc6679e125f4871a1a9958","schema":"nwe.promotion-record/0.1","to_state":"REAL_COMPILED"},"promotion_record_hash":"59b2afa06c89b1eb84679483ef59edbcc26851852f64d490bf9b0e0c0734a3a0","source_snapshot_hashes":["6d1b5611c7f7fe97ca1dcf8354ba36cf326cc2f4cfea8a8bf15836dd617e0378"],"source_snapshots":[{"attribution":"© OpenStreetMap contributors","license_profile":"ODbL-1.0","promotion_state":"VALIDATED_SOURCE","raw_byte_size":1053121,"raw_sha256":"ee4c0c6a509a137821816aa4ee0581b559bff558688861a74f5c4c5a9cb55a38","retrieval_identity":{"query_bounds":["11.00323908421006","60.214367176568494","11.021825770804512","60.223614277941905"],"request_url":"https://api.openstreetmap.org/api/0.6/map.json?bbox=11.00323908421006,60.214367176568494,11.021825770804512,60.223614277941905","tile_id":"epsg25832_611000_6677000_1000m"},"schema":"nwe.source-snapshot/0.3","source_crs":"EPSG:4326","source_id":"openstreetmap:api-0.6:map","source_vertical_datum":null,"z_semantics":"none"}],"transform_contract_hashes":["16b119b02728dace37371c16c9123123b0fcb9080501e30af31ee45ccbba940c"],"transform_contracts":[{"bounds_epsg25832":["611000","6677000","612000","6678000"],"horizontal_crs":"EPSG:25832","operation":"osm-api06-wgs84-reproject-validate-clip-epsg25832","schema":"nwe.transform-contract/0.1","source_crs":"EPSG:4326","source_snapshot_hash":"6d1b5611c7f7fe97ca1dcf8354ba36cf326cc2f4cfea8a8bf15836dd617e0378","vertical_datum":null}]}